[
  {
    "id": "cherry_blossom",
    "label": "Cherry blossom",
    "startMonthDay": "03-20",
    "endMonthDay": "04-10",
    "severity": "peak",
    "lodgingMultiplierLow": 1.4,
    "lodgingMultiplierHigh": 2.2,
    "advice": "Peak lodging demand with availability collapsing. Book 6+ months out.",
    "asOf": "2026-07-31",
    "source": "internal estimate",
    "confidence": "low"
  },
  {
    "id": "golden_week",
    "label": "Golden Week",
    "startMonthDay": "04-29",
    "endMonthDay": "05-05",
    "severity": "peak",
    "lodgingMultiplierLow": 1.4,
    "lodgingMultiplierHigh": 2.0,
    "advice": "Domestic travel peak; avoid if possible, especially for intercity rail.",
    "asOf": "2026-07-31",
    "source": "internal estimate",
    "confidence": "low"
  },
  {
    "id": "obon",
    "label": "Obon",
    "startMonthDay": "08-11",
    "endMonthDay": "08-16",
    "severity": "peak",
    "lodgingMultiplierLow": 1.4,
    "lodgingMultiplierHigh": 2.0,
    "advice": "Domestic travel peak, plus heat and humidity.",
    "asOf": "2026-07-31",
    "source": "internal estimate",
    "confidence": "low"
  },
  {
    "id": "new_year",
    "label": "New Year",
    "startMonthDay": "12-28",
    "endMonthDay": "01-04",
    "severity": "peak",
    "lodgingMultiplierLow": 1.4,
    "lodgingMultiplierHigh": 2.0,
    "advice": "Many businesses closed; transport packed around the holiday.",
    "asOf": "2026-07-31",
    "source": "internal estimate",
    "confidence": "low",
    "notes": "Window wraps the calendar year boundary (Dec 28 - Jan 4); the engine's date-overlap check must handle wraparound."
  },
  {
    "id": "autumn_foliage",
    "label": "Autumn foliage",
    "startMonthDay": "11-01",
    "endMonthDay": "11-30",
    "severity": "elevated",
    "lodgingMultiplierLow": 1.3,
    "lodgingMultiplierHigh": 1.8,
    "advice": "Especially pronounced in Kyoto.",
    "asOf": "2026-07-31",
    "source": "internal estimate",
    "confidence": "low"
  },
  {
    "id": "shoulder_early_summer",
    "label": "Shoulder sweet spot: mid-May to mid-June",
    "startMonthDay": "05-15",
    "endMonthDay": "06-15",
    "severity": "sweet_spot",
    "lodgingMultiplierLow": 0.9,
    "lodgingMultiplierHigh": 1.05,
    "advice": "Pre-rainy season; good weather and lower lodging demand.",
    "asOf": "2026-07-31",
    "source": "internal estimate",
    "confidence": "low"
  },
  {
    "id": "shoulder_autumn",
    "label": "Shoulder sweet spot: late September to late October",
    "startMonthDay": "09-20",
    "endMonthDay": "10-20",
    "severity": "sweet_spot",
    "lodgingMultiplierLow": 0.9,
    "lodgingMultiplierHigh": 1.05,
    "advice": "Before peak foliage crowds and pricing.",
    "asOf": "2026-07-31",
    "source": "internal estimate",
    "confidence": "low"
  }
]
